{
  "manifest_version": "0.2",
  "generated_at": "2026-03-14T11:30:19.648009+00:00",
  "repository_root": "D:\\ChantaResearchGroup",
  "inbox_path": "D:\\ChantaResearchGroup\\00_Inbox",
  "item_count": 1,
  "items": [
    {
      "path": "D:\\ChantaResearchGroup\\00_Inbox\\SVM-Support-Vector-Machine-D4R6.pdf",
      "relative_path": "SVM-Support-Vector-Machine-D4R6.pdf",
      "name": "SVM-Support-Vector-Machine-D4R6.pdf",
      "extension": ".pdf",
      "size": 1267655,
      "modified_time": "2021-03-05T12:51:30.854683+00:00",
      "status": "inbox",
      "candidate_domain": null,
      "tags": [],
      "confidence": null,
      "is_file": true
    }
  ]
}